{
  "schema_version": "1.0",
  "snapshot_id": "sha256:68B2F225B4FFF25626DA287E77310C377D9689AF2749D9BFAFF819B14D305DD9",
  "generated_at_utc": "2026-07-15T09:55:00Z",
  "display_timezone": "Asia/Taipei",
  "project": {
    "name": "FleetVision",
    "display_name": "FleetVision 車損辨識",
    "dashboard_kind": "PROJECT_GOVERNANCE_AND_EVIDENCE",
    "progress_label": "治理里程碑完成度，不代表工期完成度",
    "overall_progress": 63.3663
  },
  "repository": {
    "repository_name": "VincentJ9209/FleetVision",
    "repository_root": "G:/Project/FleetVision",
    "branch": "main",
    "local_head": "374b2b99b997810da3e3c2beac0d7174df7c0e5f",
    "origin_main": "374b2b99b997810da3e3c2beac0d7174df7c0e5f",
    "remote_head": "374b2b99b997810da3e3c2beac0d7174df7c0e5f",
    "checkpoint_subject": "docs: add phase04.5N design and implementation plan",
    "production_worktree_status": [
      "?? outputs/metadata/external_assets/"
    ],
    "allowed_untracked_paths": [
      "outputs/metadata/external_assets/"
    ],
    "candidate_worktrees": [
      {
        "worktree_id": "PHASE04_5N_IMPLEMENTATION",
        "purpose": "PHASE_04_5N_IMPLEMENTATION",
        "path": "C:/Users/Vincent/AppData/Local/Temp/FleetVision_phase04_5n_implementation_374b2b9",
        "branch": "phase04-5n-implementation",
        "head": "374b2b99b997810da3e3c2beac0d7174df7c0e5f",
        "status_lines": [
          "?? configs/data/phase04_5n_annotation_correction_promotion_config.yaml",
          "?? src/fleetvision/review/annotation_correction_promotion_contract.py",
          "?? src/fleetvision/review/annotation_correction_staging.py",
          "?? tests/annotation_correction_promotion_fixtures.py",
          "?? tests/test_annotation_correction_promotion_contract.py",
          "?? tests/test_annotation_correction_staging.py"
        ],
        "implementation_committed": false,
        "push_completed": false,
        "trust_level": "WORKTREE_VERIFIED"
      },
      {
        "worktree_id": "LOCAL_PROJECT_DASHBOARD",
        "purpose": "DASHBOARD",
        "path": null,
        "branch": "feature/local-project-dashboard",
        "head": "374b2b99b997810da3e3c2beac0d7174df7c0e5f",
        "status_lines": [
          "Dedicated worktree not yet created in the recorded snapshot."
        ],
        "implementation_committed": false,
        "push_completed": false,
        "trust_level": "UNVERIFIED"
      }
    ],
    "verification_level": "WORKTREE_VERIFIED",
    "verified_at_utc": "2026-07-15T09:55:00Z"
  },
  "state_alignment": {
    "value": "CANDIDATE_UNCOMMITTED",
    "summary": "Production main is synchronized. Phase 04.5N implementation files exist only as an uncommitted candidate worktree.",
    "trust_level": "WORKTREE_VERIFIED"
  },
  "current_focus": {
    "technical_phase": "Phase 04.5N — Controlled Annotation Correction Promotion",
    "technical_gate": "Implementation candidate before N1 execution",
    "formal_status": "READY",
    "candidate_status": "IN_PROGRESS",
    "current_work_summary": "Task 1 and Task 2 passed independent review; Task 3 and reported focused/regression tests passed. Candidate files remain uncommitted and unpushed.",
    "next_authorized_action": "Complete controlled implementation closure and publish the isolated implementation branch; N1/N2 execution remains separate.",
    "prohibited_actions": [
      "Execute N1 against production canonical COCO",
      "Authorize or execute N2",
      "Read test split",
      "Run model inference",
      "Modify dataset, Registry, fixed splits or canonical data",
      "Start training or retraining"
    ],
    "blocking_conditions": [
      "Candidate test counts remain operator-reported until structured test evidence is verified.",
      "N2 requires a separate explicit authorization after an N1 PASS."
    ]
  },
  "safety_gates": [
    {
      "key": "TEST_SPLIT_READ",
      "value": "NO",
      "expected_safe_value": "NO",
      "status": "SAFE_REPORTED",
      "trust_level": "OPERATOR_REPORTED",
      "source_refs": [
        {
          "type": "operator_report",
          "path": "operator_report",
          "ref": null,
          "section": "Task 1-3 implementation status"
        }
      ],
      "verified_at_utc": "2026-07-15T09:55:00Z"
    },
    {
      "key": "MODEL_INFERENCE_EXECUTED",
      "value": "NO",
      "expected_safe_value": "NO",
      "status": "SAFE_REPORTED",
      "trust_level": "OPERATOR_REPORTED",
      "source_refs": [
        {
          "type": "operator_report",
          "path": "operator_report",
          "ref": null,
          "section": "Task 1-3 implementation status"
        }
      ],
      "verified_at_utc": "2026-07-15T09:55:00Z"
    },
    {
      "key": "CANONICAL_ANNOTATION_MODIFIED",
      "value": "NO",
      "expected_safe_value": "NO",
      "status": "SAFE_REPORTED",
      "trust_level": "OPERATOR_REPORTED",
      "source_refs": [
        {
          "type": "operator_report",
          "path": "operator_report",
          "ref": null,
          "section": "Task 1-3 implementation status"
        }
      ],
      "verified_at_utc": "2026-07-15T09:55:00Z"
    },
    {
      "key": "CANONICAL_COCO_MODIFIED",
      "value": "NO",
      "expected_safe_value": "NO",
      "status": "SAFE_REPORTED",
      "trust_level": "OPERATOR_REPORTED",
      "source_refs": [
        {
          "type": "operator_report",
          "path": "operator_report",
          "ref": null,
          "section": "Task 1-3 implementation status"
        }
      ],
      "verified_at_utc": "2026-07-15T09:55:00Z"
    },
    {
      "key": "DATASET_MODIFIED",
      "value": "NO",
      "expected_safe_value": "NO",
      "status": "SAFE_REPORTED",
      "trust_level": "OPERATOR_REPORTED",
      "source_refs": [
        {
          "type": "operator_report",
          "path": "operator_report",
          "ref": null,
          "section": "Task 1-3 implementation status"
        }
      ],
      "verified_at_utc": "2026-07-15T09:55:00Z"
    },
    {
      "key": "REGISTRY_MODIFIED",
      "value": "NO",
      "expected_safe_value": "NO",
      "status": "SAFE_REPORTED",
      "trust_level": "OPERATOR_REPORTED",
      "source_refs": [
        {
          "type": "operator_report",
          "path": "operator_report",
          "ref": null,
          "section": "Task 1-3 implementation status"
        }
      ],
      "verified_at_utc": "2026-07-15T09:55:00Z"
    },
    {
      "key": "FIXED_SPLITS_MODIFIED",
      "value": "NO",
      "expected_safe_value": "NO",
      "status": "SAFE_REPORTED",
      "trust_level": "OPERATOR_REPORTED",
      "source_refs": [
        {
          "type": "operator_report",
          "path": "operator_report",
          "ref": null,
          "section": "Task 1-3 implementation status"
        }
      ],
      "verified_at_utc": "2026-07-15T09:55:00Z"
    },
    {
      "key": "TRAINING_STARTED",
      "value": "NO",
      "expected_safe_value": "NO",
      "status": "SAFE_REPORTED",
      "trust_level": "OPERATOR_REPORTED",
      "source_refs": [
        {
          "type": "operator_report",
          "path": "operator_report",
          "ref": null,
          "section": "Task 1-3 implementation status"
        }
      ],
      "verified_at_utc": "2026-07-15T09:55:00Z"
    },
    {
      "key": "RETRAINING_STATUS",
      "value": "NOT_YET_APPROVED",
      "expected_safe_value": "NOT_YET_APPROVED",
      "status": "CLEAR",
      "trust_level": "REPOSITORY_VERIFIED",
      "source_refs": [
        {
          "type": "repository_file",
          "path": "docs/superpowers/specs/2026-07-15-phase04-5n-controlled-annotation-correction-promotion-design.md",
          "ref": "374b2b99b997810da3e3c2beac0d7174df7c0e5f",
          "section": "Authorization stop"
        }
      ],
      "verified_at_utc": "2026-07-15T09:55:00Z"
    },
    {
      "key": "DEPLOYMENT_ACCEPTANCE",
      "value": "NOT_YET_APPROVED",
      "expected_safe_value": "NOT_YET_APPROVED",
      "status": "CLEAR",
      "trust_level": "REPOSITORY_VERIFIED",
      "source_refs": [
        {
          "type": "repository_file",
          "path": "docs/superpowers/specs/2026-07-15-phase04-5n-controlled-annotation-correction-promotion-design.md",
          "ref": "374b2b99b997810da3e3c2beac0d7174df7c0e5f",
          "section": "Authorization stop"
        }
      ],
      "verified_at_utc": "2026-07-15T09:55:00Z"
    }
  ],
  "phases": [
    {
      "phase_id": "PHASE_00",
      "title": "Phase 00 — Project Governance and Architecture",
      "status": "COMPLETED",
      "progress": 100.0,
      "weight": 4,
      "gate_ids": [
        "00-GOVERNANCE"
      ],
      "summary": "Repository governance remains continuously maintained.",
      "source_refs": [
        {
          "type": "repository_file",
          "path": "docs/00_project_management/MASTER_PHASE_MAP.md",
          "ref": "374b2b99b997810da3e3c2beac0d7174df7c0e5f",
          "section": "Phase map"
        }
      ]
    },
    {
      "phase_id": "PHASE_01",
      "title": "Phase 01 — Metadata Catalog",
      "status": "COMPLETED",
      "progress": 100.0,
      "weight": 5,
      "gate_ids": [
        "01-METADATA"
      ],
      "summary": "Metadata catalog completed.",
      "source_refs": [
        {
          "type": "repository_file",
          "path": "docs/00_project_management/MASTER_PHASE_MAP.md",
          "ref": "374b2b99b997810da3e3c2beac0d7174df7c0e5f",
          "section": "Phase map"
        }
      ]
    },
    {
      "phase_id": "PHASE_02",
      "title": "Phase 02 — Review Queue",
      "status": "COMPLETED",
      "progress": 100.0,
      "weight": 5,
      "gate_ids": [
        "02-REVIEW-QUEUE"
      ],
      "summary": "Review queue completed.",
      "source_refs": [
        {
          "type": "repository_file",
          "path": "docs/00_project_management/MASTER_PHASE_MAP.md",
          "ref": "374b2b99b997810da3e3c2beac0d7174df7c0e5f",
          "section": "Phase map"
        }